{
  "artifacts": [
    {
      "description": "Three-panel descriptive view of DepMap dependency, same-source cBioPortal tumor/normal expression, and GTEx normal-tissue median TPM.",
      "kind": "figure",
      "mediaType": "image/png",
      "path": "trop2_analysis.png"
    }
  ],
  "lockedAnalysis": {
    "dependencyCutoff": -0.5,
    "dependencyCutoffComparator": "lte",
    "exclusionRules": [
      "Duplicate model_id, sample_id, or tissue_id values are fatal input errors.",
      "Non-numeric non-empty measurement values are fatal input errors.",
      "Missing measurements are retained in denominators and reported as missingness.",
      "Missing DepMap lineage is labeled Unknown; lineage series require at least 5 observed gene-effect values.",
      "Unrecognized cBioPortal sample types remain unknown and are excluded from tumor and normal summaries.",
      "No inferential statistical test and no cross-source tumor-versus-normal comparison is performed."
    ],
    "lineageMinimumN": 5,
    "normalTissueStatistic": "GTEx V8 tissue median TPM; descriptive screening flag only",
    "statisticalTests": "none; preregistered descriptive analysis only",
    "tumorStatistic": "median and interquartile range, tumor and normal separately"
  },
  "results": {
    "dependency.fraction_at_or_below_locked_cutoff": {
      "comparator": "lte",
      "direction": "lower",
      "missingness": {
        "fraction": 0.0,
        "missingN": 0,
        "observedN": 1183,
        "totalN": 1183
      },
      "note": "Descriptive selectivity readout only; not evidence that an essential target should be drugged.",
      "nullable": false,
      "precision": 6,
      "sampleN": 1183,
      "threshold": -0.5,
      "tolerance": 1e-08,
      "type": "scalar",
      "unit": "fraction of observed models",
      "value": 0.000845
    },
    "dependency.median_by_lineage": {
      "comparator": "none",
      "direction": "lower",
      "groups": [
        {
          "comparator": "none",
          "direction": "lower",
          "key": "Ampulla of Vater",
          "label": "Ampulla of Vater",
          "missingness": {
            "fraction": 0.0,
            "missingN": 0,
            "observedN": 5,
            "totalN": 5
          },
          "note": "Descriptive lineage median; not an ADC suitability criterion.",
          "nullable": false,
          "precision": 4,
          "sampleN": 5,
          "threshold": null,
          "tolerance": 1e-06,
          "type": "scalar",
          "unit": "Chronos gene effect",
          "value": 0.0125
        },
        {
          "comparator": "none",
          "direction": "lower",
          "key": "Biliary Tract",
          "label": "Biliary Tract",
          "missingness": {
            "fraction": 0.0,
            "missingN": 0,
            "observedN": 34,
            "totalN": 34
          },
          "note": "Descriptive lineage median; not an ADC suitability criterion.",
          "nullable": false,
          "precision": 4,
          "sampleN": 34,
          "threshold": null,
          "tolerance": 1e-06,
          "type": "scalar",
          "unit": "Chronos gene effect",
          "value": 0.0035
        },
        {
          "comparator": "none",
          "direction": "lower",
          "key": "Bladder/Urinary Tract",
          "label": "Bladder/Urinary Tract",
          "missingness": {
            "fraction": 0.0,
            "missingN": 0,
            "observedN": 34,
            "totalN": 34
          },
          "note": "Descriptive lineage median; not an ADC suitability criterion.",
          "nullable": false,
          "precision": 4,
          "sampleN": 34,
          "threshold": null,
          "tolerance": 1e-06,
          "type": "scalar",
          "unit": "Chronos gene effect",
          "value": -0.0512
        },
        {
          "comparator": "none",
          "direction": "lower",
          "key": "Bone",
          "label": "Bone",
          "missingness": {
            "fraction": 0.0,
            "missingN": 0,
            "observedN": 47,
            "totalN": 47
          },
          "note": "Descriptive lineage median; not an ADC suitability criterion.",
          "nullable": false,
          "precision": 4,
          "sampleN": 47,
          "threshold": null,
          "tolerance": 1e-06,
          "type": "scalar",
          "unit": "Chronos gene effect",
          "value": -0.0738
        },
        {
          "comparator": "none",
          "direction": "lower",
          "key": "Bowel",
          "label": "Bowel",
          "missingness": {
            "fraction": 0.0,
            "missingN": 0,
            "observedN": 63,
            "totalN": 63
          },
          "note": "Descriptive lineage median; not an ADC suitability criterion.",
          "nullable": false,
          "precision": 4,
          "sampleN": 63,
          "threshold": null,
          "tolerance": 1e-06,
          "type": "scalar",
          "unit": "Chronos gene effect",
          "value": -0.0205
        },
        {
          "comparator": "none",
          "direction": "lower",
          "key": "Breast",
          "label": "Breast",
          "missingness": {
            "fraction": 0.0,
            "missingN": 0,
            "observedN": 53,
            "totalN": 53
          },
          "note": "Descriptive lineage median; not an ADC suitability criterion.",
          "nullable": false,
          "precision": 4,
          "sampleN": 53,
          "threshold": null,
          "tolerance": 1e-06,
          "type": "scalar",
          "unit": "Chronos gene effect",
          "value": -0.0382
        },
        {
          "comparator": "none",
          "direction": "lower",
          "key": "CNS/Brain",
          "label": "CNS/Brain",
          "missingness": {
            "fraction": 0.0,
            "missingN": 0,
            "observedN": 89,
            "totalN": 89
          },
          "note": "Descriptive lineage median; not an ADC suitability criterion.",
          "nullable": false,
          "precision": 4,
          "sampleN": 89,
          "threshold": null,
          "tolerance": 1e-06,
          "type": "scalar",
          "unit": "Chronos gene effect",
          "value": -0.0833
        },
        {
          "comparator": "none",
          "direction": "lower",
          "key": "Cervix",
          "label": "Cervix",
          "missingness": {
            "fraction": 0.0,
            "missingN": 0,
            "observedN": 18,
            "totalN": 18
          },
          "note": "Descriptive lineage median; not an ADC suitability criterion.",
          "nullable": false,
          "precision": 4,
          "sampleN": 18,
          "threshold": null,
          "tolerance": 1e-06,
          "type": "scalar",
          "unit": "Chronos gene effect",
          "value": 0.0015
        },
        {
          "comparator": "none",
          "direction": "lower",
          "key": "Esophagus/Stomach",
          "label": "Esophagus/Stomach",
          "missingness": {
            "fraction": 0.0,
            "missingN": 0,
            "observedN": 69,
            "totalN": 69
          },
          "note": "Descriptive lineage median; not an ADC suitability criterion.",
          "nullable": false,
          "precision": 4,
          "sampleN": 69,
          "threshold": null,
          "tolerance": 1e-06,
          "type": "scalar",
          "unit": "Chronos gene effect",
          "value": -0.0087
        },
        {
          "comparator": "none",
          "direction": "lower",
          "key": "Eye",
          "label": "Eye",
          "missingness": {
            "fraction": 0.0,
            "missingN": 0,
            "observedN": 15,
            "totalN": 15
          },
          "note": "Descriptive lineage median; not an ADC suitability criterion.",
          "nullable": false,
          "precision": 4,
          "sampleN": 15,
          "threshold": null,
          "tolerance": 1e-06,
          "type": "scalar",
          "unit": "Chronos gene effect",
          "value": 0.06
        },
        {
          "comparator": "none",
          "direction": "lower",
          "key": "Head and Neck",
          "label": "Head and Neck",
          "missingness": {
            "fraction": 0.0,
            "missingN": 0,
            "observedN": 77,
            "totalN": 77
          },
          "note": "Descriptive lineage median; not an ADC suitability criterion.",
          "nullable": false,
          "precision": 4,
          "sampleN": 77,
          "threshold": null,
          "tolerance": 1e-06,
          "type": "scalar",
          "unit": "Chronos gene effect",
          "value": -0.0004
        },
        {
          "comparator": "none",
          "direction": "lower",
          "key": "Kidney",
          "label": "Kidney",
          "missingness": {
            "fraction": 0.0,
            "missingN": 0,
            "observedN": 35,
            "totalN": 35
          },
          "note": "Descriptive lineage median; not an ADC suitability criterion.",
          "nullable": false,
          "precision": 4,
          "sampleN": 35,
          "threshold": null,
          "tolerance": 1e-06,
          "type": "scalar",
          "unit": "Chronos gene effect",
          "value": -0.0319
        },
        {
          "comparator": "none",
          "direction": "lower",
          "key": "Liver",
          "label": "Liver",
          "missingness": {
            "fraction": 0.0,
            "missingN": 0,
            "observedN": 24,
            "totalN": 24
          },
          "note": "Descriptive lineage median; not an ADC suitability criterion.",
          "nullable": false,
          "precision": 4,
          "sampleN": 24,
          "threshold": null,
          "tolerance": 1e-06,
          "type": "scalar",
          "unit": "Chronos gene effect",
          "value": -0.0155
        },
        {